{
  "contract_version": "HIBOU_VIDEO_CONTRACT_V1",
  "contract_state": "storyboard",
  "content": {
    "content_id": "donation-cession-v1",
    "script_version": 1,
    "profile_version": "HIBOU_VIRAL_V1@2.0",
    "method_version": "VIDEO_METHOD_V2"
  },
  "engine": {
    "renderer": "ffmpeg-local",
    "renderer_version": "1",
    "fps": 30,
    "width": 1080,
    "height": 1920,
    "preset": "veryfast"
  },
  "scenes": [
    {
      "scene_id": "donation-cession-v1_scene_01",
      "order": 1,
      "narration_exact": {
        "mode": "text_reference",
        "text": "Pourquoi donner ses actions",
        "script_sha256": "b8c298bb0a1548debdfbe8fe2043f1bb677034ab422ddf0a6bae9c1abe92ed43"
      },
      "visual_idea": "Hibou tient des certificats d’actions comme un cadeau à transmettre.",
      "screen_text": "Pourquoi donner ses actions…",
      "planned_duration_s": 1.8,
      "measured_duration_s": null,
      "zoom_percent": 3,
      "image": {
        "candidates": [],
        "selected": null,
        "selection_reason": null,
        "prompt": "vertical 9:16, semi-realistic French finance editorial illustration, clean shapes, muted dark green cream and warm gold, cinematic light, strong smartphone readability, no infographic layout, no embedded text; Le Hibou Rusé when specified: same yellow-eyed owl, gold monocle, black tuxedo, tall slim silhouette, intelligent mischievous expression; owl holding share certificates tied with a modest gift ribbon, questioning expression, hook"
      },
      "breath_unit": "Pourquoi donner ses actions",
      "voice": {
        "target_wpm": 210,
        "relative_speed_pct": 102,
        "pause_after_ms": 80,
        "emphasis": "donner ses actions",
        "intent": "hook"
      }
    },
    {
      "scene_id": "donation-cession-v1_scene_02",
      "order": 2,
      "narration_exact": {
        "mode": "text_reference",
        "text": "juste avant de les vendre ?",
        "script_sha256": "b8c298bb0a1548debdfbe8fe2043f1bb677034ab422ddf0a6bae9c1abe92ed43"
      },
      "visual_idea": "Calendrier : donation puis vente, ordre des actes visible.",
      "screen_text": "…juste avant de vendre ?",
      "planned_duration_s": 1.8,
      "measured_duration_s": null,
      "zoom_percent": 3,
      "image": {
        "candidates": [],
        "selected": null,
        "selection_reason": null,
        "prompt": "vertical 9:16, semi-realistic French finance editorial illustration, clean shapes, muted dark green cream and warm gold, cinematic light, strong smartphone readability, no infographic layout, no embedded text; calendar sequence with gift of shares immediately before a sale contract, clear chronology, no tiny labels"
      },
      "breath_unit": "juste avant de les vendre ?",
      "voice": {
        "target_wpm": 210,
        "relative_speed_pct": 102,
        "pause_after_ms": 250,
        "emphasis": "avant / vendre",
        "intent": "hook"
      }
    },
    {
      "scene_id": "donation-cession-v1_scene_03",
      "order": 3,
      "narration_exact": {
        "mode": "text_reference",
        "text": "Parce qu’après une vraie donation,",
        "script_sha256": "b8c298bb0a1548debdfbe8fe2043f1bb677034ab422ddf0a6bae9c1abe92ed43"
      },
      "visual_idea": "Donateur remet réellement les titres au donataire.",
      "screen_text": "Après une vraie donation",
      "planned_duration_s": 1.8,
      "measured_duration_s": null,
      "zoom_percent": 3,
      "image": {
        "candidates": [],
        "selected": null,
        "selection_reason": null,
        "prompt": "vertical 9:16, semi-realistic French finance editorial illustration, clean shapes, muted dark green cream and warm gold, cinematic light, strong smartphone readability, no infographic layout, no embedded text; genuine transfer of company shares from donor to recipient, recipient clearly becomes holder, formal not theatrical"
      },
      "breath_unit": "Parce qu’après une vraie donation,",
      "voice": {
        "target_wpm": 198,
        "relative_speed_pct": 100,
        "pause_after_ms": 120,
        "emphasis": "vraie donation",
        "intent": "explication"
      }
    },
    {
      "scene_id": "donation-cession-v1_scene_04",
      "order": 4,
      "narration_exact": {
        "mode": "text_reference",
        "text": "la valeur d’acquisition retenue",
        "script_sha256": "b8c298bb0a1548debdfbe8fe2043f1bb677034ab422ddf0a6bae9c1abe92ed43"
      },
      "visual_idea": "Document fiscal de valorisation des titres.",
      "screen_text": "Valeur d’acquisition",
      "planned_duration_s": 1.8,
      "measured_duration_s": null,
      "zoom_percent": 3,
      "image": {
        "candidates": [],
        "selected": null,
        "selection_reason": null,
        "prompt": "vertical 9:16, semi-realistic French finance editorial illustration, clean shapes, muted dark green cream and warm gold, cinematic light, strong smartphone readability, no infographic layout, no embedded text; close-up of share valuation document and stamped acquisition value, elegant French legal-finance setting, no readable paragraphs"
      },
      "breath_unit": "la valeur d’acquisition retenue",
      "voice": {
        "target_wpm": 195,
        "relative_speed_pct": 99,
        "pause_after_ms": 80,
        "emphasis": "valeur d’acquisition",
        "intent": "règle"
      }
    },
    {
      "scene_id": "donation-cession-v1_scene_05",
      "order": 5,
      "narration_exact": {
        "mode": "text_reference",
        "text": "pour la plus-value du donataire",
        "script_sha256": "b8c298bb0a1548debdfbe8fe2043f1bb677034ab422ddf0a6bae9c1abe92ed43"
      },
      "visual_idea": "Schéma donataire → prix de vente moins valeur d’acquisition.",
      "screen_text": "Pour la plus-value du donataire",
      "planned_duration_s": 1.8,
      "measured_duration_s": null,
      "zoom_percent": 3,
      "image": {
        "candidates": [],
        "selected": null,
        "selection_reason": null,
        "prompt": "vertical 9:16, semi-realistic French finance editorial illustration, clean shapes, muted dark green cream and warm gold, cinematic light, strong smartphone readability, no infographic layout, no embedded text; simple capital gain visual for recipient: sale proceeds contrasted with acquisition value, one clear subtraction concept, no formulas as embedded text"
      },
      "breath_unit": "pour la plus-value du donataire",
      "voice": {
        "target_wpm": 195,
        "relative_speed_pct": 99,
        "pause_after_ms": 100,
        "emphasis": "plus-value du donataire",
        "intent": "règle"
      }
    },
    {
      "scene_id": "donation-cession-v1_scene_06",
      "order": 6,
      "narration_exact": {
        "mode": "text_reference",
        "text": "est en principe la valeur retenue",
        "script_sha256": "b8c298bb0a1548debdfbe8fe2043f1bb677034ab422ddf0a6bae9c1abe92ed43"
      },
      "visual_idea": "Même valeur circule du document de donation au calcul ultérieur.",
      "screen_text": "En principe : valeur retenue",
      "planned_duration_s": 1.8,
      "measured_duration_s": null,
      "zoom_percent": 3,
      "image": {
        "candidates": [],
        "selected": null,
        "selection_reason": null,
        "prompt": "vertical 9:16, semi-realistic French finance editorial illustration, clean shapes, muted dark green cream and warm gold, cinematic light, strong smartphone readability, no infographic layout, no embedded text; value on official gift-tax file carried into later capital-gain calculation, connected documents, restrained visual"
      },
      "breath_unit": "est en principe la valeur retenue",
      "voice": {
        "target_wpm": 192,
        "relative_speed_pct": 98,
        "pause_after_ms": 80,
        "emphasis": "en principe / valeur retenue",
        "intent": "règle"
      }
    },
    {
      "scene_id": "donation-cession-v1_scene_07",
      "order": 7,
      "narration_exact": {
        "mode": "text_reference",
        "text": "pour les droits de donation.",
        "script_sha256": "b8c298bb0a1548debdfbe8fe2043f1bb677034ab422ddf0a6bae9c1abe92ed43"
      },
      "visual_idea": "Acte de donation et avis de droits.",
      "screen_text": "Droits de donation",
      "planned_duration_s": 1.8,
      "measured_duration_s": null,
      "zoom_percent": 3,
      "image": {
        "candidates": [],
        "selected": null,
        "selection_reason": null,
        "prompt": "vertical 9:16, semi-realistic French finance editorial illustration, clean shapes, muted dark green cream and warm gold, cinematic light, strong smartphone readability, no infographic layout, no embedded text; French donation deed and gift-tax assessment documents on desk, sober legal scene, no readable personal data"
      },
      "breath_unit": "pour les droits de donation.",
      "voice": {
        "target_wpm": 190,
        "relative_speed_pct": 98,
        "pause_after_ms": 180,
        "emphasis": "droits de donation",
        "intent": "règle"
      }
    },
    {
      "scene_id": "donation-cession-v1_scene_08",
      "order": 8,
      "narration_exact": {
        "mode": "text_reference",
        "text": "La plus-value latente antérieure",
        "script_sha256": "b8c298bb0a1548debdfbe8fe2043f1bb677034ab422ddf0a6bae9c1abe92ed43"
      },
      "visual_idea": "Avant donation : hausse historique de valeur des titres.",
      "screen_text": "Plus-value latente antérieure",
      "planned_duration_s": 1.8,
      "measured_duration_s": null,
      "zoom_percent": 3,
      "image": {
        "candidates": [],
        "selected": null,
        "selection_reason": null,